{
  "station": "shima-shimmei",
  "validFrom": "2026-03-14",
  "validTo": null,
  "retrieved": "2026-10-17",
  "source": "https://eki.kintetsu.co.jp/norikae/T5?USR=PC&slCode=454-15&d=1&dw=0",
  "sources": [
    {
      "type": "official",
      "url": "https://eki.kintetsu.co.jp/norikae/T5?USR=PC&slCode=454-15&d=1&dw=0",
      "retrieved": "2026-10-17",
      "note": "近鐵時刻表：志摩線 伊勢中川・白塚方面（平日）"
    },
    {
      "type": "official",
      "url": "https://eki.kintetsu.co.jp/norikae/T5?USR=PC&slCode=454-15&d=2&dw=0",
      "retrieved": "2026-10-17",
      "note": "近鐵時刻表：志摩線 賢島方面（平日）"
    },
    {
      "type": "official",
      "url": "https://eki.kintetsu.co.jp/norikae/T5?USR=PC&slCode=454-15&d=1&dw=1",
      "retrieved": "2026-10-17",
      "note": "近鐵時刻表：志摩線 伊勢中川・白塚方面（土休日）"
    },
    {
      "type": "official",
      "url": "https://eki.kintetsu.co.jp/norikae/T5?USR=PC&slCode=454-15&d=2&dw=1",
      "retrieved": "2026-10-17",
      "note": "近鐵時刻表：志摩線 賢島方面（土休日）"
    },
    {
      "type": "official",
      "url": "https://www.kintetsu.co.jp/station/station_info/station20019.html",
      "retrieved": "2026-10-17",
      "note": "近鐵車站頁（時刻表連結）"
    }
  ],
  "directions": {
    "for-ise-nakagawa": {
      "weekday": [
        {
          "dep": "05:11",
          "type": "普通",
          "to": "ise-nakagawa",
          "trainNo": "1-3896",
          "note": null
        },
        {
          "dep": "05:42",
          "type": "普通",
          "to": "ise-nakagawa",
          "trainNo": "1-3897",
          "note": null
        },
        {
          "dep": "06:09",
          "type": "普通",
          "to": "toba",
          "trainNo": "1-3873",
          "note": null
        },
        {
          "dep": "06:39",
          "type": "普通",
          "to": "ise-nakagawa",
          "trainNo": "1-3899",
          "note": null
        },
        {
          "dep": "07:06",
          "type": "普通",
          "to": "toba",
          "trainNo": "1-3872",
          "note": null
        },
        {
          "dep": "07:33",
          "type": "普通",
          "to": "toba",
          "trainNo": "1-3874",
          "note": null
        },
        {
          "dep": "08:14",
          "type": "普通",
          "to": "ise-nakagawa",
          "trainNo": "1-3903",
          "note": null
        },
        {
          "dep": "08:39",
          "type": "普通",
          "to": "ise-nakagawa",
          "trainNo": "1-3900",
          "note": null
        },
        {
          "dep": "09:14",
          "type": "普通",
          "to": "ise-nakagawa",
          "trainNo": "1-3906",
          "note": null
        },
        {
          "dep": "10:17",
          "type": "普通",
          "to": "ise-nakagawa",
          "trainNo": "1-3898",
          "note": null
        },
        {
          "dep": "11:17",
          "type": "普通",
          "to": "ise-nakagawa",
          "trainNo": "1-3907",
          "note": null
        },
        {
          "dep": "12:17",
          "type": "普通",
          "to": "ise-nakagawa",
          "trainNo": "1-3908",
          "note": null
        },
        {
          "dep": "13:17",
          "type": "普通",
          "to": "ise-nakagawa",
          "trainNo": "1-3909",
          "note": null
        },
        {
          "dep": "14:16",
          "type": "普通",
          "to": "ise-nakagawa",
          "trainNo": "1-3910",
          "note": null
        },
        {
          "dep": "15:15",
          "type": "普通",
          "to": "ise-nakagawa",
          "trainNo": "1-3911",
          "note": null
        },
        {
          "dep": "15:47",
          "type": "普通",
          "to": "ise-nakagawa",
          "trainNo": "1-3917",
          "note": null
        },
        {
          "dep": "16:17",
          "type": "普通",
          "to": "ise-nakagawa",
          "trainNo": "1-3912",
          "note": null
        },
        {
          "dep": "16:45",
          "type": "普通",
          "to": "ise-nakagawa",
          "trainNo": "1-3918",
          "note": null
        },
        {
          "dep": "17:16",
          "type": "普通",
          "to": "ise-nakagawa",
          "trainNo": "1-3913",
          "note": null
        },
        {
          "dep": "17:42",
          "type": "普通",
          "to": "ise-nakagawa",
          "trainNo": "1-3901",
          "note": null
        },
        {
          "dep": "18:18",
          "type": "普通",
          "to": "ise-nakagawa",
          "trainNo": "1-3914",
          "note": null
        },
        {
          "dep": "19:00",
          "type": "普通",
          "to": "shiratsuka",
          "trainNo": "1-4299",
          "note": null
        },
        {
          "dep": "19:26",
          "type": "普通",
          "to": "ise-nakagawa",
          "trainNo": "1-3915",
          "note": null
        },
        {
          "dep": "19:59",
          "type": "普通",
          "to": "ise-nakagawa",
          "trainNo": "1-3905",
          "note": null
        },
        {
          "dep": "20:36",
          "type": "普通",
          "to": "ise-nakagawa",
          "trainNo": "1-3916",
          "note": null
        },
        {
          "dep": "21:31",
          "type": "普通",
          "to": "ise-nakagawa",
          "trainNo": "1-3902",
          "note": null
        },
        {
          "dep": "22:16",
          "type": "普通",
          "to": "ise-nakagawa",
          "trainNo": "1-3904",
          "note": null
        }
      ],
      "holiday": [
        {
          "dep": "05:18",
          "type": "普通",
          "to": "ise-nakagawa",
          "trainNo": "1-8866",
          "note": null
        },
        {
          "dep": "05:43",
          "type": "普通",
          "to": "toba",
          "trainNo": "1-8838",
          "note": null
        },
        {
          "dep": "06:20",
          "type": "普通",
          "to": "ise-nakagawa",
          "trainNo": "1-8883",
          "note": null
        },
        {
          "dep": "06:42",
          "type": "普通",
          "to": "ise-nakagawa",
          "trainNo": "1-8864",
          "note": null
        },
        {
          "dep": "07:08",
          "type": "普通",
          "to": "toba",
          "trainNo": "1-8837",
          "note": null
        },
        {
          "dep": "07:34",
          "type": "普通",
          "to": "toba",
          "trainNo": "1-8839",
          "note": null
        },
        {
          "dep": "08:11",
          "type": "普通",
          "to": "ise-nakagawa",
          "trainNo": "1-8862",
          "note": null
        },
        {
          "dep": "08:46",
          "type": "普通",
          "to": "ise-nakagawa",
          "trainNo": "1-8865",
          "note": null
        },
        {
          "dep": "09:16",
          "type": "普通",
          "to": "ise-nakagawa",
          "trainNo": "1-8878",
          "note": null
        },
        {
          "dep": "10:18",
          "type": "普通",
          "to": "ise-nakagawa",
          "trainNo": "1-8881",
          "note": null
        },
        {
          "dep": "11:17",
          "type": "普通",
          "to": "ise-nakagawa",
          "trainNo": "1-8882",
          "note": null
        },
        {
          "dep": "12:17",
          "type": "普通",
          "to": "ise-nakagawa",
          "trainNo": "1-8879",
          "note": null
        },
        {
          "dep": "13:17",
          "type": "普通",
          "to": "ise-nakagawa",
          "trainNo": "1-8880",
          "note": null
        },
        {
          "dep": "14:15",
          "type": "普通",
          "to": "ise-nakagawa",
          "trainNo": "1-8876",
          "note": null
        },
        {
          "dep": "15:16",
          "type": "普通",
          "to": "ise-nakagawa",
          "trainNo": "1-8867",
          "note": null
        },
        {
          "dep": "15:47",
          "type": "普通",
          "to": "ise-nakagawa",
          "trainNo": "1-8868",
          "note": null
        },
        {
          "dep": "16:17",
          "type": "普通",
          "to": "ise-nakagawa",
          "trainNo": "1-8869",
          "note": null
        },
        {
          "dep": "16:43",
          "type": "普通",
          "to": "ise-nakagawa",
          "trainNo": "1-8870",
          "note": null
        },
        {
          "dep": "17:18",
          "type": "普通",
          "to": "ise-nakagawa",
          "trainNo": "1-8861",
          "note": null
        },
        {
          "dep": "17:42",
          "type": "普通",
          "to": "ise-nakagawa",
          "trainNo": "1-8871",
          "note": null
        },
        {
          "dep": "18:17",
          "type": "普通",
          "to": "ise-nakagawa",
          "trainNo": "1-8872",
          "note": null
        },
        {
          "dep": "18:45",
          "type": "普通",
          "to": "ise-nakagawa",
          "trainNo": "1-8863",
          "note": null
        },
        {
          "dep": "19:17",
          "type": "普通",
          "to": "ise-nakagawa",
          "trainNo": "1-8873",
          "note": null
        },
        {
          "dep": "19:59",
          "type": "普通",
          "to": "ise-nakagawa",
          "trainNo": "1-8877",
          "note": null
        },
        {
          "dep": "20:26",
          "type": "普通",
          "to": "ise-nakagawa",
          "trainNo": "1-8875",
          "note": null
        },
        {
          "dep": "21:11",
          "type": "普通",
          "to": "ise-nakagawa",
          "trainNo": "1-8874",
          "note": null
        },
        {
          "dep": "22:16",
          "type": "普通",
          "to": "ise-nakagawa",
          "trainNo": "1-8860",
          "note": null
        }
      ]
    },
    "for-kashikojima": {
      "weekday": [
        {
          "dep": "06:30",
          "type": "普通",
          "to": "kashikojima",
          "trainNo": "1-3792",
          "note": null
        },
        {
          "dep": "06:56",
          "type": "普通",
          "to": "kashikojima",